[
  {
    "panel_id": "page_001_panel_002",
    "reading_order": 2,
    "resolved_characters": [
      {
        "name": "Katara",
        "visual_label": "Figure in blue, fur-lined clothes, standing next to Sokka",
        "confidence": "high",
        "evidence": [
          "Dialogue notes refer to narrator as Katara; context places Katara at the scene."
        ]
      },
      {
        "name": "Sokka",
        "visual_label": "Figure in blue, fur-lined clothes, standing with Katara",
        "confidence": "high",
        "evidence": [
          "Dialogue identifies 'my brother Sokka,' implying both siblings present."
        ]
      },
      {
        "name": "Aang",
        "visual_label": "Silhouette inside glowing sphere/iceberg",
        "confidence": "medium",
        "evidence": [
          "Dialogue says 'discovered the new Avatar, an airbender named Aang'; figure in sphere assumed to be Aang, but not confirmed by visuals."
        ]
      }
    ],
    "continuity_links": [
      "{\"panel_id\": \"page_001_panel_001\", \"type\": \"narration continuity\", \"evidence\": \"Previous narration sets up that a hundred years have passed; this panel concludes that setup with the discovery of Aang.\"}"
    ],
    "panel_role": "payoff",
    "setup_payoff_relation": {
      "setup_panel_ids": [
        "page_001_panel_001"
      ],
      "payoff_panel_ids": [
        "page_001_panel_002"
      ],
      "setup": "Establishes a time jump of a hundred years and describes a search or wait for the new Avatar.",
      "payoff": "Katara and Sokka discover Aang, frozen in ice, resolving the setup narration.",
      "mechanism": "Narration bridges the passage of time and directly connects the discovery of the Avatar to the previously established absence.",
      "effect": "Delivers the pivotal moment of finding the Avatar, an inciting event in the story."
    },
    "joke_or_dramatic_mechanism": "Dramatic reveal/payoff: The suspense and mystery of a missing Avatar culminates in the visual of Aang encased in ice.",
    "corrected_story_function": "Inciting incident—Katara and Sokka discovering Aang after a long absence, marking a key turning point and narrative transition.",
    "adaptation_notes": [
      "Use voiceover narration to carry Katara's lines and emphasize the passage of a hundred years.",
      "Visually highlight the glow and focus on the sphere/iceberg, suggesting its importance.",
      "Dramatic music should swell as the camera reveals Aang to underscore the significance.",
      "Show Katara and Sokka's physical reactions (awe/surprise) for emotional weight.",
      "Consider a brief montage or visual dissolve from the previous panel to imply the passage of time."
    ],
    "uncertainty_notes": [
      "Figure in the ice is almost certainly Aang, but not named on-screen or visually confirmed in this panel alone.",
      "Assumed identities of Katara and Sokka are based on context and dialogue, not distinctive visual labels in this single panel."
    ],
    "concise_contextual_summary": "After a stated passage of a hundred years, Katara and Sokka stand on the ice and discover the Avatar, Aang, in a glowing, frozen sphere—marking the story's inciting event."
  },
  {
    "panel_id": "page_001_panel_003",
    "reading_order": 3,
    "resolved_characters": [
      {
        "name": "Aang",
        "visual_label": "young monk in orange/yellow robes",
        "confidence": "high",
        "evidence": [
          "Distinctive attire and prior narration link this to the previously discovered 'airbender named Aang'."
        ]
      },
      {
        "name": "Katara (narrator)",
        "visual_label": "narration only (not pictured)",
        "confidence": "moderate",
        "evidence": [
          "Narration continuity and pronoun reference ('my brother Sokka and I') from previous panel, although not visually depicted."
        ]
      }
    ],
    "continuity_links": [
      "page_001_panel_002"
    ],
    "panel_role": "reveal",
    "setup_payoff_relation": {
      "setup_panel_ids": [
        "page_001_panel_002"
      ],
      "payoff_panel_ids": [
        "page_001_panel_003"
      ],
      "setup": "Aang is identified as the new Avatar, discovered by Katara and Sokka after being trapped in ice for a hundred years.",
      "payoff": "Katara’s narration shifts to Aang’s past, demonstrating his early airbending training and her enduring belief in his destiny.",
      "mechanism": "The reveal sequence shifts from discovery (ice sphere) to flashback/training (Aang’s earlier life), reinforcing Katara’s faith in him and foreshadowing his growth.",
      "effect": "Bridges the immediate discovery of Aang to a broader context of his abilities and the central hope Katara places in him."
    },
    "joke_or_dramatic_mechanism": "Flashback shows Aang's inexperience despite being the Avatar, paired with Katara’s retrospective, heartfelt narration—a mix of light slapstick and dramatic foreshadowing.",
    "corrected_story_function": "Reveals Aang’s airbending inexperience through action and juxtaposes it with the narrator’s steady faith in his potential, transitioning from discovery to character insight and dramatic setup.",
    "adaptation_notes": [
      "Voice-over narration should shift from past tense discovery to reflective admiration and hope.",
      "Sound design: Audibly emphasize Aang’s 'Oof!' and the comedic impact of him being knocked back.",
      "Visual pacing: Transition from kinetic knockback to calm, wide establishing shot for contemplative mood.",
      "Narrator’s emotional tone should transition from descriptive to quietly inspirational."
    ],
    "uncertainty_notes": [
      "Flashback location is not specified.",
      "Narrator is inferred to be Katara based on previous dialogue context."
    ],
    "concise_contextual_summary": "Continuation from Aang’s discovery shifts to Katara’s narration about his past training and her belief in his destiny, using a flashback and visual juxtaposition to build both character insight and dramatic anticipation."
  },
  {
    "panel_id": "page_001_panel_004",
    "reading_order": 4,
    "resolved_characters": [
      {
        "name": "Katara",
        "visual_label": "",
        "confidence": "high",
        "evidence": [
          "The previous panels are narrated in first person by Katara. The continuity of narration is unbroken, and the line 'I WAS RIGHT.' follows directly after Katara’s reflections about Aang's destiny."
        ]
      }
    ],
    "continuity_links": [
      "page_001_panel_002",
      "page_001_panel_003"
    ],
    "panel_role": "payoff",
    "setup_payoff_relation": {
      "setup_panel_ids": [
        "page_001_panel_003"
      ],
      "payoff_panel_ids": [
        "page_001_panel_004"
      ],
      "setup": "Katara narrates her belief that Aang would save the world from the moment she met him.",
      "payoff": "The bold declaration 'I WAS RIGHT.' confirms her belief was justified.",
      "mechanism": "Emotional and narrative reinforcement: the assertion in the previous panel is validated with emphatic, isolated text.",
      "effect": "Creates a strong, conclusive transition from hope/faith to certainty, affirming Katara’s perspective."
    },
    "joke_or_dramatic_mechanism": "Emphatic narrative affirmation; textual punchline to a dramatic setup.",
    "corrected_story_function": "Serves as a narrator's emphatic confirmation that her earlier faith in Aang was justified, acting as both payoff to the established narrative arc and a dramatic, memorable transition.",
    "adaptation_notes": [
      "Pace this as a beat of silence or a break in music to let the bold text land.",
      "Consider overlaying the bold 'I WAS RIGHT.' text on a white screen, accompanied by a brief sound of narrative resolution (e.g., a musical swell or a gentle chime).",
      "No voiced dialogue needed except for the narration; if narrated, deliver the line with strong conviction.",
      "This is the payoff to Katara’s earlier narration—ensure it comes across with emotional weight."
    ],
    "uncertainty_notes": [
      "No characters are shown visually; character attribution is based solely on preceding narration.",
      "If adapting visually, there is a risk of abruptness; ensure clear continuity from Katara’s narration."
    ],
    "concise_contextual_summary": "Katara, after recounting her hopeful belief in Aang's destiny, declares she was correct, closing her narration arc with a bold affirmation."
  },
  {
    "panel_id": "page_001_panel_005",
    "reading_order": 5,
    "resolved_characters": [
      {
        "name": "Uncertain (possible main cast: Aang, Sokka, Katara)",
        "visual_label": "Person lying on ground",
        "confidence": "low",
        "evidence": [
          "No explicit visual or dialogue cues; previous context involved Aang, Sokka, Katara."
        ]
      },
      {
        "name": "Uncertain (possible main cast or antagonist)",
        "visual_label": "Person standing",
        "confidence": "low",
        "evidence": [
          "No clear identification; standing posture suggests victor or observer after a confrontation."
        ]
      }
    ],
    "continuity_links": [
      "page_001_panel_004",
      "page_001_panel_003"
    ],
    "panel_role": "payoff",
    "setup_payoff_relation": {
      "setup_panel_ids": [
        "page_001_panel_003",
        "page_001_panel_004"
      ],
      "payoff_panel_ids": [
        "page_001_panel_005"
      ],
      "setup": "Panel 3 and 4 establish confidence in Aang's ability to save the world, culminating in the emphatic statement 'I WAS RIGHT.'",
      "payoff": "Panel 5 visually depicts a confrontation's aftermath, suggesting either vindication of that belief or the cost of such a conflict.",